task_id,action_summary,why_needed,destination,required_docs,steps_short,steps_detail,office_hours,address,phone,done_condition,faq
RN-M3-01,故人の財産（プラス）と負債（マイナス）を把握した上で、相続するか放棄するかを判断する。放棄する場合は3か月以内に家庭裁判所に申し立てが必要。,期限を過ぎると自動的に「単純承認」（負債も全て相続）になります。,管轄の家庭裁判所,相続放棄申述書、故人の戸籍謄本、住民票の除票、申述人の戸籍謄本、収入印紙800円、郵便切手,1. プラスの財産とマイナスの財産を把握する\n2. プラスが多い場合は何もしなくて大丈夫です（単純承認）\n3. マイナスが多い/不明な場合は相続放棄を検討する\n4. 放棄する場合は家庭裁判所に申述書を提出する\n5. 判断がつかない場合は期間伸長の申し立てをする,1. 財産目録（RN-M3-07）と負債調査（RN-M3-02）を並行して進めてください。\n2. —\n3.【重要】期限は相続開始を知った日から3か月以内です。超えると自動的にすべて相続することになります。\n4. 管轄の家庭裁判所に相談してください。必要物：申述書・故人の戸籍謄本・住民票の除票・申述人の戸籍謄本・収入印紙800円・切手。\n5. 期限前に家裁に申し立てれば3か月延長が認められることがあります。,平日 8:30-17:00,,,相続の方針が決定。放棄する場合は家裁に申述済み。,Q.3か月で判断できない→家庭裁判所に期間伸長の申し立てができます\nQ.放棄するとどうなる？→最初から相続人でなかった扱いになります。財産も負債も一切引き継ぎません\nQ.一部だけ放棄できる？→できません。全部承認か全部放棄の二択です
RN-M3-02,故人の借金・保証債務・連帯債務を調査し、負債の全体像を把握する。信用情報機関への開示請求で確認可能。,相続すると負債も引き継ぎます。相続放棄の判断（3か月以内）に間に合うよう早めに調べてください。\n【信用情報の照会】CIC・JICC・全国銀行個人信用情報センター(KSC) の3機関に開示請求すれば、故人のクレジットカード・ローン・キャッシング・保証債務の履歴を確認できます (郵送・各1500円程度)。,信用情報機関（CIC・JICC・KSC）、故人の自宅,戸籍謄本、届出者の本人確認書類、死亡確認書類,1. 自宅で借用書・ローン契約書・督促状を探す\n2. 通帳の引落し記録からローンを確認する\n3. 信用情報機関3か所に開示請求する\n4. 結果をリスト化する,1. —\n2. 「○○ファイナンス」「○○カード」等の記載があれば借入の可能性があります。\n3. CIC（0570-666-414）\nJICC（0570-021-717）\nKSC（03-3214-5020）\n各約1000円、郵送も可能です。「相続人として故人の信用情報の開示請求をしたい」と伝える。\n必要物：戸籍謄本・本人確認書類・死亡確認書類。\n4. 個人間の貸借・連帯保証は信用情報に載りません。契約書で確認が必要です。,各機関による,,CIC：0570-666-414／JICC：0570-021-717／KSC：03-3214-5020,負債の全体像が把握されリスト化されている。,Q.相続人でも信用情報の開示請求はできる？→はい。戸籍謄本等があれば請求できます\nQ.連帯保証人の確認方法は？→信用情報で一部判明します。個人間の保証は記載されないため契約書で確認が必要です\nQ.開示請求の費用は？→1機関あたり約1000円です
RN-M3-03,故人の出生から死亡までの連続した戸籍謄本と、相続人全員の戸籍謄本・印鑑証明書を集める。ほぼすべての相続手続きで必要な基本書類。,出生から死亡までの連続した戸籍で法定相続人が確定します。銀行・法務局・税務署などあらゆる場面で必要です。,故人の本籍地の役場／広域交付制度で最寄り役場も可,請求者の本人確認書類、印鑑、手数料（1通450〜750円）,1. 故人の出生〜死亡までの連続した戸籍謄本を取得する\n2. 相続人全員の現在の戸籍謄本を取得する\n3. 相続人全員の印鑑証明書を2〜3通ずつ取得する,1. 本籍地は住民票の除票で確認できます。\n取得方法：本籍地の役場（直接/郵送）、または広域交付制度で最寄りの役場でも可（2024年3月〜）。\n手数料：1通450〜750円。\n2. 各相続人が自分の本籍地の役場で取得してください。\n3. 住所地の役場またはコンビニ（マイナンバーカードがあれば）で取得してください。,平日 8:30-17:15,,,故人の連続した戸籍と相続人全員の戸籍・印鑑証明書がすべて揃っている。,Q.広域交付とは？→2024年3月から本籍地以外の役場でも戸籍が取得できるようになりました\nQ.何通ずつ必要？→手続きごとに1セット提出するのが一般的です。返却後に使い回す場合は受取人に確認してください\nQ.本籍地が遠方→郵送請求ができます。広域交付制度の活用も検討してください
RN-M3-04,故人名義の住宅ローンや借入金について借入先に届け出る。団体信用生命保険（団信）に加入していれば、保険金でローンが完済される。,団信に加入していれば残債がゼロになります。届出が遅れると遅延損害金が発生するリスクがあります。,借入先の金融機関,死亡診断書コピー、届出人の本人確認書類、戸籍謄本、ローン契約書,1. 借入先の金融機関に電話して届出する\n2. 団体信用生命保険（団信）の加入有無を確認する\n3. 団信加入→保険金でローン完済の手続きをする\n4. 団信未加入→返済引継ぎ or 相続放棄を検討する,1. 「借入人が亡くなりました。届出をしたい」と伝えてください。届出が遅れると遅延損害金のリスクがあります。\n2. これが最も重要な確認事項です。住宅ローンの場合ほぼ加入しています。\n3. 金融機関の案内に従い保険金を請求してください。残債全額が返済されます。\n4. —,各金融機関による,,,住宅ローン・借入金の届出完了、団信の適用有無確認済み。,Q.団信に入っているかわからない→住宅ローン契約時にほぼ加入しています。借入先に確認してください\nQ.団信で残債がゼロになる？→はい。残債全額が保険金で返済されます\nQ.連帯債務の場合→故人の分のみ団信で完済されます。もう一方の債務は残ります
RN-M3-07,故人のプラスの財産（預貯金・不動産・株式・保険等）とマイナスの財産（ローン・借金・未払い税金等）をすべてリスト化して「財産目録」を作成する。,遺産分割協議、相続税申告、相続放棄の判断など、すべての相続手続きの土台になる最も重要な書類です。\n【含めるべきもの】(プラス財産) 預貯金・株式・投資信託・暗号資産・不動産・車・貴金属・ゴルフ会員権・生命保険金・退職金 / (マイナス財産) 住宅ローン・カードローン・保証債務・税金未納・医療費未払・葬式費用・損害賠償金。,,通帳、証券書類、登記簿、固定資産税通知書、保険証券、借用書、ローン契約書等,1. プラスの財産をリスト化する（預貯金・不動産・有価証券・保険・自動車等）\n2. マイナスの財産をリスト化する（ローン・借入金・未払い税金・医療費等）\n3. 各財産の評価額を確認する（死亡日時点）\n4. 一覧表にまとめて相続人全員に共有する,1. 預金→銀行に残高証明書を請求してください。不動産→役場で固定資産評価証明書を取得してください。株式→証券会社に残高証明書を請求してください（評価は死亡日の終値です）。\n2. —\n3. 農地の評価は固定資産税評価額と相続税評価額が異なります。税理士に相談をおすすめします。\n4. 遺産分割協議（RN-M3-11）・相続税申告・相続放棄判断のすべての土台になります。,,,,相続財産目録が完成し、相続人全員に共有されている。,Q.評価額の調べ方は？→預金は残高証明書、不動産は固定資産評価証明書、株式は死亡日の終値です\nQ.財産の所在がわからない→通帳・郵便物・確定申告書から手がかりを探してください\nQ.農地の評価は？→固定資産税評価額と相続税評価額は異なります。税理士に相談をおすすめします
RN-M3-11,相続人全員で遺産の分け方を話し合い、合意した内容を「遺産分割協議書」にまとめる。全員の署名・実印・印鑑証明書が必要。,不動産の名義変更、銀行口座の解約・払戻し、相続税申告で必要な重要書類です。,,相続財産目録（RN-M3-07）、戸籍・印鑑証明書（RN-M3-03）、各相続人の実印,1. 財産目録をもとに分け方を全員で話し合う\n2. 全員合意→遺産分割協議書を作成する\n3. 全員が署名＋実印を押印＋印鑑証明書を添付する\n4. 人数分の部数を作成する,1. 法定相続分を参考にしつつ、合意があれば自由な割合で分けられます。\n2. 記載内容：被相続人の情報・全相続人の氏名・各財産の取得者（具体的に記載）。\n3. 認印では銀行等の手続きで受付できません。必ず実印を使ってください。\n遠方の相続人は郵送リレー方式で対応できます（書留で追跡番号を共有してください）。\n4. まとまらない場合は家庭裁判所の遺産分割調停または弁護士に相談してください。,,,,協議書が完成し、全相続人の署名・実印・印鑑証明書が揃っている。,Q.相続人が遠方にいる→郵送で順番に署名・押印していくリレー方式が一般的です\nQ.まとまらない場合→家庭裁判所の遺産分割調停を利用するか、弁護士に相談してください\nQ.自分で作成できる？→可能ですが、不動産がある場合は司法書士への依頼をおすすめします
RN-M4-01,故人の1月1日から死亡日までの所得について、相続人が代わりに確定申告（「準確定申告」）を行う。,一定の所得がある場合、4か月以内に申告する義務があります。申告しないと加算税・延滞税のリスクがあります。,管轄の税務署,源泉徴収票、確定申告関連書類（医療費領収書・保険料控除証明書等）、本人確認書類、「確定申告書付表」,1. 準確定申告が必要か判断する\n2. 必要な場合→源泉徴収票・領収書等を集める\n3. 確定申告書と「付表」を作成し相続人全員が署名\n4. 管轄の税務署に提出する（郵送可）,1. 年金400万円以下＆他の所得20万円以下→原則不要です。事業/不動産所得がある場合は必要です。判断できなければ管轄の税務署に電話で確認してください。\n2. 所得計算期間は1月1日〜死亡日です。\n3. 国税庁Web「確定申告書等作成コーナー」で作成できます。\n4. 管轄の税務署に提出してください。不動産/事業所得がある場合は税理士への依頼をおすすめします。,平日 8:30-17:00,,,要否判定済み。必要な場合は申告書提出済み。,Q.年金収入だけの場合→年金400万円以下で他の所得20万円以下なら原則不要です。ただし医療費控除で還付を受けられる場合は申告がお得です\nQ.自分でできる？→単純なケースなら可能です。不動産・事業所得がある場合は税理士をおすすめします\nQ.期限を過ぎたら→期限後申告は可能ですが、加算税・延滞税がかかることがあります
RN-M10-01,相続財産の総額が基礎控除額（3000万円＋600万円×相続人の数）を超えるか確認する。超える場合は10か月以内に相続税の申告・納付が必要。,基礎控除を超える場合のみ課税されます。特例を使って税額ゼロでも、申告は必要です。\n【基礎控除額】3000万円 + 600万円 × 法定相続人数。例:配偶者+子1人なら4200万円、子2人なら4800万円。\n【期限】相続を知った日の翌日から10か月以内。期限後申告は加算税・延滞税の対象。,管轄の税務署,相続財産目録（RN-M3-07）、不動産評価書類、残高証明書等,1. 基礎控除額を計算する（3000万＋600万×相続人数）\n2. 財産総額 ≦ 基礎控除→申告不要\n3. 財産総額 ＞ 基礎控除→申告が必要\n4. 税理士への依頼を検討する,1. 例）相続人2人→4200万円、3人→4800万円。\n2. —\n3. 特例で税額ゼロでも申告は必要です。期限は死亡日から10か月以内です。\n4. 費用目安：遺産総額の0.5〜1%です。管轄の税務署に相談してください。農地には「納税猶予の特例」がある場合があります。,平日 8:30-17:00,,,要否判定済み。必要な場合は税理士に依頼済みまたは準備中。,Q.相続人2人の場合の非課税枠は？→4200万円までは非課税です\nQ.税理士の費用は？→遺産総額の0.5〜1%が目安です\nQ.農地に特別な制度はある？→農業相続人には「納税猶予の特例」があります
RN-M10-05,遺産分割協議の確定後、故人名義の銀行口座を解約して預金を受け取る。,口座凍結後の預金は遺産分割協議書等を提出しないと引き出せません。,各銀行の窓口,遺産分割協議書/遺言書、戸籍謄本一式/法定相続情報一覧図、相続人全員の印鑑証明書、本人確認書類、通帳・カード、銀行所定の相続届出書,1. 各銀行から相続届出書を取り寄せる\n2. 必要書類を揃える\n3. 銀行窓口で手続きし払戻し先口座を指定,1. 遺産分割協議（RN-M3-11）確定後に手続き可能です。\n2. 主な必要物：銀行所定の届出書（全員の署名・実印）・遺産分割協議書・戸籍一式 or 法定相続情報一覧図・印鑑証明書・本人確認書類・通帳/カード。\n3. 処理に1〜3週間。法定相続情報一覧図があれば複数行を並行して進められます。,平日 9:00-15:00（窓口）,,,全銀行口座の解約・払戻し完了、相続人口座に振込済み。,Q.遺産分割前に一部引き出せる？→「相続預金の払戻し制度」で各口座残高×1/3×法定相続分（上限150万円）まで引き出せます\nQ.通帳を紛失した→通帳なしで手続きできます\nQ.銀行ごとに個別手続き？→はい。法定相続情報一覧図があると効率的です\nQ.戸籍謄本とは？\n→故人の家族関係（配偶者・子供など）を証明する公的書類です。\nQ.「出生から死亡まで」の戸籍はなぜ必要？\n→相続人が誰なのかを正式に確認するためです。婚姻・離婚・養子縁組などで戸籍が変わるため、すべての変遷をたどる必要があります。\nQ.戸籍はどこで取れる？\n→故人の本籍地の市区町村役場で取得できます。本籍地が複数回変わっている場合は、それぞれの自治体から取り寄せが必要です。郵送請求も可能です。\nQ.戸籍の広域交付制度とは？\n→令和6年（2024年）3月から、最寄りの市区町村窓口で他の自治体の戸籍もまとめて取得できるようになりました。ただし一部対応していない自治体もあるため、事前に電話確認をおすすめします。\nQ.戸籍の取得費用は？\n→戸籍謄本は1通450円、除籍謄本・改製原戸籍は1通750円です。本籍地の変更回数が多いと、合計で数千円〜2万円程度かかることがあります。\nQ.「原戸籍」「除籍謄本」とは？\n→「改製原戸籍（かいせいはらこせき）」は法改正前の古い形式の戸籍です。「除籍謄本」は全員が転籍・死亡などで抜けた戸籍です。どちらも「出生から死亡まで」をたどる際に必要になることがあります。\nQ.戸籍の取り寄せを専門家に頼める？\n→司法書士や行政書士に依頼すれば、職権で戸籍を一括取得してもらえます。費用は数万円程度ですが、自分で複数の自治体に郵送請求する手間と時間を大幅に削減できます。
RN-M10-07,故人名義の自動車の名義変更（移転登録）または廃車（抹消登録）を行う。故人名義のままでは車検更新や売却ができない。,故人名義のままだと車検更新も売却もできません。自動車税の納付義務も残ります。,普通車：管轄の運輸支局／軽：軽自動車検査協会,車検証、故人の戸籍謄本、遺産分割協議書、相続人の印鑑証明書・車庫証明書・委任状,1. 車検証で故人名義を確認する\n2. 使い続ける場合→名義変更する、手放す場合→廃車 or 売却する\n3. 普通車→管轄の運輸支局、軽→軽自動車検査協会\n4. 自動車保険の名義変更も忘れずに行う,1. 所有者がディーラー/ローン会社の場合は先に所有権解除が必要です。\n2. 売却する場合はまず名義変更が必要です。\n3. 管轄の運輸支局（平日対応）。必要物：車検証・戸籍謄本・遺産分割協議書・印鑑証明書・車庫証明書。代行はディーラー/行政書士に依頼可（1〜3万円）。\n4. 自動車保険は契約先の保険会社に連絡してください。,平日 8:45-16:00（運輸支局）,,,名義変更/廃車手続きが完了。,Q.売却したい→まず名義変更してから売却してください\nQ.自動車税は？→名義変更すると新しい所有者に課税されます。廃車は月割で還付されます\nQ.手続きを代行してほしい→ディーラーや行政書士に依頼できます（1〜3万円程度）
RN-Y3-01,故人名義の土地・建物の名義を相続人に変更する「相続登記」を法務局に申請する。固定資産評価証明書は市区町村役場で取得できます。,2024年4月から義務化されました。「相続発生と不動産取得を知った日から3年以内」が起算日で、申請しないと10万円以下の過料の対象になります。登記しないと売却も担保設定もできません。,最寄りの法務局,登記申請書、戸籍謄本一式/法定相続情報一覧図、遺産分割協議書/遺言書、印鑑証明書、固定資産評価証明書、住民票、登録免許税（評価額の0.4%）,1. 固定資産評価証明書を役場で取得する\n2. 登記申請書を作成する（法務局Webに記載例あり）\n3. 必要書類を揃え、登録免許税（評価額×0.4%）を計算する\n4. 法務局に申請する（窓口 or 郵送）\n5. 登記識別情報通知を受け取り安全に保管する,1. 約300円です。\n2. —\n3. 必要物：\n・申請書\n・戸籍一式 or 法定相続情報一覧図\n・遺産分割協議書\n・印鑑証明書\n・新所有者の住民票\n・固定資産評価証明書\n登録免許税は収入印紙で納付します。\n4. 最寄りの法務局に申請してください。1〜2週間で完了します。郵送申請も可能です。法務局の「登記手続案内」（予約制・無料）で書き方を教えてもらえます。\n5.【重要】2024年4月から義務化。3年以内に未申請だと10万円以下の過料の対象になります。\n登記識別情報は紛失すると再発行できません。\n農地も相続登記が必要です（農業委員会届出とは別）。\n複雑な案件は司法書士に依頼してください（1件5〜10万円目安）。,平日 8:30-17:15,,,全不動産の相続登記が完了し、登記識別情報通知を受領済み。,Q.自分でできる？→単純な案件なら可能です。法務局の「登記手続案内」（予約制）で無料相談できます\nQ.司法書士の費用は？→1件5〜10万円程度です\nQ.農地も登記が必要？→はい。農業委員会への届出とは別に登記も必要です
RN-D7-30,故人が会社員だった場合、会社の健康保険(協会けんぽ・組合健保)の資格喪失届を勤務先経由で5日以内に提出する,国民健康保険(14日)より短い5日が法定期限です。被扶養者がいた場合は同時に国保切替が必要になります。,故人の勤務先(健康保険組合・協会けんぽ),故人と扶養者全員の健康保険証,1. 故人の勤務先(人事・総務)に死亡を連絡する\n2. 健康保険証を本人・扶養者全員分 集めて勤務先へ返却する\n3. 5日以内に勤務先が資格喪失届を提出する\n4. 被扶養者がいた場合は別途 国民健康保険への切替を行う(RN-D14-23),1. 「死亡したため健康保険の資格喪失手続きをお願いします」と伝えれば 通常は人事部が対応してくれます。\n2. 葬儀で時間が取れない場合 まず電話連絡だけして 保険証は後日郵送でも受け付ける勤務先が多いです。\n3. 法定期限は5日ですが 勤務先の対応スピードに依存するため 早めの連絡が安心です。\n4. 扶養に入っていた家族(配偶者・子)は 健康保険証が使えなくなるため 速やかに国保切替が必要です(無保険期間ができないように)。,平日 9-17時 (勤務先による),,,健康保険証を返却し、勤務先から資格喪失証明書を受領済み。,Q.葬儀で忙しい→電話連絡だけ先に。書類は後日でOKな勤務先が多い\nQ.扶養家族の保険は？→国保切替が必要(RN-D14-23参照)\nQ.5日を過ぎたら？→法定期限ですが 数日遅れても勤務先が処理してくれることが多い
RN-D7-31,故人が亡くなる時点で失業給付を受給していた場合、雇用保険受給資格者証をハローワークに1か月以内に返還する,返還しないまま放置すると過払いを請求される可能性があります。受給は本人死亡時点でストップします。,故人が手続きしていたハローワーク,雇用保険受給資格者証/死亡を証明する書類,1. ハローワークに電話して死亡を連絡する\n2. 受給資格者証と死亡を証明する書類(住民票除票等)を持参する\n3. 1か月以内に返還する\n4. 未支給分があれば「未支給失業給付請求書」を遺族が請求する,1. 「失業給付受給中の家族が亡くなりました」と伝えれば 必要書類を案内してもらえます。\n2. 故人の住所地のハローワークが原則です。\n3. 返還が遅れると過払い請求される可能性があります。\n4. 死亡日までに発生した未支給分は 生計同一の遺族が請求できます。請求期限は6か月以内のため早めに。,平日 8:30-17:15,各ハローワーク,各ハローワーク,雇用保険受給資格者証を返還し、未支給分を請求済み。,Q.受給していたか不明→ハローワークに電話で確認できます\nQ.未支給分はいくら？→死亡日までの未払い分。直近振込日からの日数で計算\nQ.遠方のハローワーク→電話で郵送可能か確認してください
