task_id,action_summary,why_needed,destination,required_docs,steps_short,steps_detail,office_hours,address,phone,done_condition,faq
RN-D14-08,遺族基礎年金・遺族厚生年金の受給資格があるか確認し、該当する場合は請求手続きを進める。年額80〜200万円以上になることも。,遺族年金は生活を支える非常に大きな制度です。該当するなら必ず請求してください。\n【中高齢寡婦加算】夫が亡くなったとき妻が40歳以上65歳未満で、子のない場合は中高齢寡婦加算が加算されます。\n【受給対象者】配偶者・子・父母・孫・祖父母 (兄弟姉妹は対象外)。,年金事務所,故人の年金証書、戸籍謄本、住民票、収入証明、振込先口座、死亡診断書コピー,1. 遺族基礎年金の対象か確認する（18歳以下の子がいる配偶者/子）\n2. 遺族厚生年金の対象か確認する（故人に会社員歴があれば子なし配偶者でも対象）\n3. 年金事務所に電話して受給資格を確認する\n4. 該当する場合は書類を揃えて請求する,1. 年額約80万円＋子の加算です。\n2. 金額は加入期間と報酬によります。年金事務所で試算してもらえます。\n3. 管轄の年金事務所（ねんきんダイヤル 0570-05-1165）に「遺族年金を受け取れるか確認したい」と伝える。年金証書を手元に準備してください。\n4. 請求から支給開始まで3〜4か月。5年以内なら遡及受給が可能です。\n年額80〜200万円以上になることもあるので、必ず確認してください。,平日 8:30-17:15,,0570-05-1165（ねんきんダイヤル）,受給資格の有無が確認済み。該当する場合は請求に着手済み。,Q.共働きでも受け取れる？→年収850万円未満なら受給できます\nQ.子どもがいなくてももらえる？→遺族厚生年金は子なしでも配偶者が受給できる場合があります\nQ.いくらもらえる？→加入期間と報酬によります。年金事務所で試算してもらえます
RN-D14-09,故人名義の銀行口座について、各銀行に死亡を届け出る。届け出ると口座が凍結される。凍結前に引落し整理（RN-D7-10）を済ませておくこと。,口座凍結で不正引き出しを防止します。相続手続きの起点にもなります。\n【口座が把握できない場合】通帳・キャッシュカード・郵便物・スマホアプリを確認。さらに「全国銀行協会の預金口座照会制度」で複数行を一括照会できます (実費)。ゆうちょ銀行・JAバンク・信用金庫もそれぞれ別途確認してください。,各銀行の窓口,届出者の本人確認書類、故人の通帳・カード、死亡確認書類,1. 自動引落しの整理（RN-D7-10）を先に完了する\n2. 口座がある銀行すべてに電話して届出方法を確認する\n3. 各銀行の窓口で届出する\n4. 「相続手続きの必要書類リスト」をもらう,1.【重要】届出をすると口座が凍結されます。名義変更が必要な引落しを先に済ませてください。\n2. 「口座名義人が亡くなりました。届出をしたい」と伝えてください。\n3. 持ち物：届出人の本人確認書類・故人の通帳/カード・死亡確認書類。\n4. 当面の生活費が必要なら「相続預金の払戻し制度」で各口座150万円まで引出し可能です。\n口座の解約・払戻しは遺産分割確定後（RN-M10-05）に行います。,平日 9:00-15:00（窓口）,,,全銀行口座について死亡届出が完了している。,Q.凍結されると生活費が引き出せない？→「相続預金の払戻し制度」で1口座150万円まで引き出せます\nQ.全部同時に届け出る？→同時でなくても大丈夫ですが、不正引き出し防止のため早めに届け出てください\nQ.ネット銀行は？→カスタマーセンターに電話して届け出てください
RN-D14-10,故人名義の証券口座について、証券会社に死亡を届け出る。届出後は相続手続き完了まで売買できません。,口座凍結で不正売却を防止します。相続手続き完了まで売買はできなくなります。\n【対象口座】通常口座・特定口座・NISA口座・iDeCo (RN-D14-27 別タスク)・財形貯蓄が含まれます。,各証券会社の窓口/カスタマーセンター,届出者の本人確認書類、故人の口座番号がわかる書類、死亡確認書類,1. 証券口座の有無を確認する（郵便物・通帳の配当金入金等）\n2. 各社のカスタマーセンターに電話して届出する\n3. 相続人名義の口座開設についても確認する,1. 確定申告書控えやPCのブックマークも手がかりになります。\n2. 「口座名義人が亡くなりました。届出をしたい」と伝えてください。届出後は相続手続き完了まで売買できません。\n3. どの証券会社かわからない場合は、証券保管振替機構（ほふり）に開示請求できます。,各社による,,,全証券口座について死亡届出が完了。,Q.どの証券会社かわからない→通帳の入金記録、郵便物、確定申告書から手がかりを探してください\nQ.株価が下がっているので早く売りたい→相続手続き完了まで売買不可です。速やかに手続きを進めてください\nQ.証券保管振替機構に照会できる？→はい。相続人から照会請求できます
RN-D14-11,故人が加入していた生命保険の死亡保険金を請求する。医療保険・共済はそれぞれ別タスク(RN-D14-11b/11c)。,保険金は請求しないと支払われません。葬儀費用や当面の生活費に充てられるため、早めの請求をおすすめします。請求期限は3年(かんぽ生命は5年)。\n【加入先不明な場合】生命保険協会の「契約照会制度」(1件3000円)で、故人の生命保険契約の有無を一括照会できます。,加入していた各生命保険会社のカスタマーセンター,保険証券、死亡診断書コピー、受取人の本人確認書類・戸籍謄本・振込先口座・印鑑,1. 加入先を確認する(保険証券・通帳の引落し記録)\n2. 各社に電話して「死亡保険金の請求をしたい」と伝える\n3. 請求書類一式を取り寄せる\n4. 書類を揃えて記入・返送する,1. わからない場合は生命保険協会の「契約照会制度」で調べられます。\n2. —\n3. —\n4. 同封するもの:死亡診断書コピー・受取人の本人確認書類/戸籍謄本/振込先口座。5営業日〜1か月で振込されます。,各社による(多くは平日9:00-17:00),,,生命保険の死亡保険金請求書を全社に提出済み。,Q.保険証券が見つからない→生命保険協会の「契約照会制度」で調べられます\nQ.受取人が故人本人になっている→法定相続人が受取人になります\nQ.相続財産になる？→受取人が指定されていれば固有財産です。ただし相続税の対象にはなります
RN-D14-15,故人名義の電気・ガス・水道の契約について、名義変更または解約をする。,故人名義のままだと請求書が届かなくなったり、供給が停止されるリスクがあります。,契約している電力会社,故人名義の請求書/契約書、新名義人の本人確認書類,1. 電力会社を確認する(検針票・通帳の引落し記録)\n2. 住み続ける場合は電話で名義変更する\n3. 空き家にする場合は解約する\n4. オール電化住宅の場合はとくに早急に手続きする,1. 検針票か直近の引落し履歴で会社名がわかります。\n2. 「契約者が亡くなりました。名義変更をお願いしたい」と伝えれば電話1本で完了することが多いです。\n3. ブレーカーを落としてから解約手続き。最終料金の精算は1か月程度。\n4. オール電化なら止めると暖房・給湯すべて止まるため要注意。,各電力会社による(平日 9-17時),,,電気契約の名義変更または解約が完了。,Q.電話1本でできる？→名義変更は電話のみで完了することが多いです\nQ.電力会社がわからない→検針票か通帳の引落し履歴で確認\nQ.オール電化の解約は？→暖房・給湯が止まるため十分に検討
RN-D14-16,故人名義の通信契約（携帯電話・インターネット回線・サブスクリプション）を解約またはMNP／移管する。,放置すると毎月料金が発生し続けます。携帯番号はSMSの二段階認証に使われていることが多いため、解約前に他サービスの引き継ぎを確認してください。,各キャリアショップまたはカスタマーセンター,故人の携帯・SIMカード、届出人の本人確認書類、死亡証明書、故人との関係がわかる戸籍,1. SMS二段階認証に使われているサービスを先に他に移管する\n2. 主要 SNS・LINE のバックアップを取る\n3. キャリアに連絡して死亡解約またはMNPする\n4. SIMカードを返却する,1.【重要】携帯を先に解約すると 他のサービス(銀行・SNS等)にログインできなくなることがあります。\n2. LINEのバックアップは特に重要(トーク履歴が消える)。\n3. キャリアに電話またはショップで手続き。死亡解約は違約金が免除されることが多いです。\n4. SIMカード返却で完了。固定電話は別タスク(現在は本タスクに統合)。,キャリアショップ:10:00〜19:00が一般的,,,故人の携帯電話の解約またはMNPが完了。,Q.暗証番号がわからない→戸籍謄本と死亡証明があれば解約できるキャリアがほとんどです\nQ.LINEのデータを残したい→解約前にバックアップを取ってください\nQ.違約金はかかる？→死亡による解約は免除されることが多いです
RN-D14-17,故人名義のクレジットカードについて、カード会社に届け出て解約する。カード決済のサブスクや定期支払いがないかも確認。,放置すると年会費が発生し、不正利用のリスクもあります。\n【家族カード注意】故人本人カードに加え、家族向けに発行された家族カードも一緒に解約手続きが必要です。,各カード会社のカスタマーセンター,クレジットカード/会員番号、届出人の本人確認書類、死亡確認書類,1. 故人名義のカードをリストアップする\n2. 各社に電話して「名義人死亡による解約」を依頼する\n3. カード決済のサブスク・未払い残高・リボ残高を確認する\n4. カード本体をハサミで裁断する,1. 財布・郵便物・通帳・スマホ決済アプリを確認してください。\n2. 会員番号不明でも氏名・生年月日と死亡証明で手続きできます。\n3. カード解約前にサブスクの切り替え先を確認しておいてください。\n4. ICチップ部分と磁気ストライプ部分を切断してください。,各社による（24時間対応あり）,,,全カードの解約完了、未払い残高の精算方法確認済み。,Q.暗証番号がわからなくても解約できる？→はい。会員番号と死亡証明があれば手続きできます\nQ.リボ払いの残高がある→相続人に支払い義務があります。一括か分割か相談してください\nQ.ポイントは使える？→ほとんどの場合失効します。カード会社に確認してください
RN-D14-18,故人名義の賃貸住宅（公営住宅含む）の名義変更または解約をする。住み続ける場合は名義変更、退去する場合は解約。退去が決まったら郵便局で郵便転送届も出すこと。,公営住宅は独自の規定があるため早めに役場に相談してください。,民間：管理会社・大家／公営住宅：市区町村役場,賃貸借契約書、届出人の本人確認書類、死亡確認書類,1. 町営住宅→役場に連絡する（承継 or 退去を相談）\n2. 民間賃貸→管理会社/大家に連絡する（名義変更 or 解約）\n3. 退去する場合は遺品整理の日程も調整する\n4. 退去が決まったら郵便局で転居届（転送届）を提出する,1. 公営住宅は市区町村役場に連絡してください。同居家族なら承継（名義変更）できる場合があります。\n2. 解約は通常1か月前予告が必要です。敷金精算も確認してください。\n3. 業者に依頼する場合は2〜3社から見積もりを取ることをおすすめします。\n4. 郵便局窓口またはe転居（オンライン）で手続きできます。\n届出から反映まで1週間程度です。転送期間は1年間です（延長可）。\n故人宛の重要書類（税金通知・保険案内等）を見逃さないために必ず行ってください。,役場：平日 8:30-17:15／管理会社：営業時間内,,,賃貸住宅の名義変更/解約の手続きが完了（開始済み）。郵便転送届が必要な場合は提出済み。,Q.公営住宅に住み続けたい→同居家族なら承継できる場合があります。役場に相談してください\nQ.退去のタイミング→解約予告期間（通常1か月前）が必要です\nQ.遺品整理業者を探している→近隣の業者に見積もりを取ってください\nQ.郵便転送届はいつ出す？→退去が決まったらすぐに届け出てください。反映まで1週間程度かかります\nQ.転送期間は？→1年間です。延長もできます
RN-D14-20,故人が遺言書を残していないか、自宅・銀行の貸金庫・法務局・公証役場を確認する。自筆証書遺言（法務局保管以外）は絶対に開封しないこと。,遺言書がある場合はその内容に基づいて相続手続きが進みます。無視して分割するとトラブルの原因になります。,故人の自宅／法務局／公証役場,確認時：特になし／照会時：本人確認書類、戸籍謄本等,1. 故人の自宅を探す（仏壇・金庫・書斎・タンス）\n2. 法務局で保管の有無を確認する（800円）\n3. 公証役場の遺言検索システムで公正証書遺言を確認する\n4. 自筆遺言が見つかったら絶対に開封せず家庭裁判所で検認する,1. 銀行の貸金庫も確認してください。\n2. 最寄りの法務局で「遺言書保管事実証明書」を請求してください（郵送請求も可能です）。\n3. 戸籍謄本と本人確認書類を持参して照会してください。\n4. 法務局保管・公正証書の場合は検認不要でそのまま使えます。遺言書がなければ遺産分割協議（RN-M3-11）へ。,法務局・公証役場：平日 8:30-17:15,,,遺言書の有無が確認済み。ある場合は検認手続き（必要時）に着手済み。,Q.見つけた遺言書を開けてしまった→開封しても遺言書は無効にはなりませんが、過料の対象になることがあります。速やかに家裁で検認してください\nQ.遺言書がなかったら→法定相続分に基づいて遺産分割協議を行います\nQ.遺言書の内容に納得できない→遺留分侵害額請求（期限1年）が可能です
RN-D14-23,故人が会社の健康保険（社保）に加入していて、その扶養に入っていた方は、国民健康保険への加入またはご自身の勤務先の保険への切り替えが必要。,故人の社保資格喪失に伴い、扶養家族の資格もなくなります。手続きしないと無保険状態になります。,国保：市区町村役場／ご自身の勤務先,故人の保険証（または資格喪失証明書）、被扶養者の本人確認書類、印鑑,1. 14日以内に切り替えないと無保険状態になることを確認する\n2. 自分の勤務先の社保に加入する場合は総務に連絡する\n3. 国保に加入する場合は役場に資格喪失証明書を持参する\n4. 任意継続（最長2年）を選ぶ場合は国保と保険料を比較して決める,1. 故人の社保の扶養に入っていた方全員が対象です。\n2. お子さんも一緒に扶養に入れられます。\n3. 資格喪失証明書は故人の勤務先から入手。持ち物：資格喪失証明書・本人確認書類・印鑑。\n4. 任意継続は20日以内に申し込みが必要です。保険料が全額自己負担になるため高くなることが多いです。\n切り替え前に病院にかかったら、後日新保険証を提示すれば差額返金されます。,平日 8:30-17:15（役場）,,,被扶養者全員の保険切り替えが完了し、新しい保険証を取得済み。,Q.切り替え前に病院にかかったら→後から精算できます。新しい保険証を後日病院に提出してください\nQ.国保と任意継続どちらがお得？→保険料を比較してください。故人の給与が高かった場合は国保の方が安いことが多いです\nQ.子どもの保険は？→国保に加入するか、もう一方の親の社保の扶養に入れてください
RN-D14-24,配偶者が亡くなり、高校卒業までのお子さんがいる場合、児童扶養手当（月額最大45500円）やひとり親関連の給付を確認・申請する。,申請月の翌月分から支給されるため、早めの申請が有利です。,市区町村役場,請求者と子の戸籍謄本、住民票、所得証明書、振込先口座、年金手帳、印鑑,1. 配偶者死亡＆18歳以下の子がいる場合が対象であることを確認する\n2. 役場に電話して「児童扶養手当の申請を相談したい」と伝える\n3. 必要書類を揃えて窓口で申請する\n4. ひとり親医療費助成・就学援助・住宅手当も確認する,1. 全部支給で月額45500円（子1人。最新額は役場にご確認ください）所得制限があります。\n2. 市区町村役場に電話してください。必要書類を案内してもらえます。\n3. 主な持ち物：戸籍謄本・住民票・所得証明書・振込先口座・印鑑。\n4. 児童手当の受給者変更も忘れずに行ってください。遺族年金と併給の場合は差額が支給されます。,平日 8:30-17:15,,,受給資格確認済み。該当する場合は申請提出済み。,Q.いくらもらえる？→全部支給で月45500円（2024年11月〜。最新額は役場にご確認ください）\nQ.所得制限はある？→全部支給は年収約160万円以下が目安です\nQ.遺族年金と両方もらえる？→遺族年金の額が児童扶養手当より少なければ差額が支給されます
RN-D14-27,故人がiDeCo（個人型確定拠出年金）や企業型確定拠出年金（企業型DC）に加入していた場合、遺族が「死亡一時金」を請求できる。請求しないと5年で権利が消滅し国庫に帰属する。,数十万〜数百万円の資産が請求漏れで国庫に帰属するケースが実際に発生しています。公的年金（RN-D14-06〜08）とは別の制度なので、忘れずに確認してください。,iDeCo：加入していた金融機関（運営管理機関）／企業型DC：故人の勤務先,死亡診断書コピー、届出人の本人確認書類、戸籍謄本、届出人の振込先口座,1. 故人がiDeCo・企業型DCに加入していたか確認する\n2. iDeCo→運営管理機関に電話して「加入者死亡による一時金請求をしたい」と伝える\n3. 企業型DC→故人の勤務先の総務に連絡する\n4. 請求書類を取り寄せ、記入・返送する,1. 確認方法：\n・故人の勤務先に聞く\n・通帳の引落し記録で「国民年金基金連合会」の記載を探す\n・故人宛の郵便物で運営管理機関からの通知を探す\n2. 運営管理機関がわからない場合は、国民年金基金連合会（03-5411-6129）に「加入者が亡くなりました。運営管理機関を教えてほしい」と問い合わせてください。\n3. 企業型DCは勤務先の総務/人事が手続きを案内してくれます。故人の勤務先届出（RN-D7-14）と一緒に確認するとスムーズです。\n4. 審査後1〜2か月で振込されます。受取人の順位は配偶者→子→父母→孫→祖父母→兄弟姉妹です。,国民年金基金連合会：平日 9:00-17:00,,国民年金基金連合会：03-5411-6129,加入の有無を確認済み。加入していた場合は請求書を提出済み。,Q.加入しているかわからない→勤務先に聞くか、通帳で「国民年金基金連合会」の引落しを探してください\nQ.いくらもらえる？→加入期間と運用状況によります。運営管理機関に残高を確認してください\nQ.公的年金の手続きとは別？→はい。遺族年金（RN-D14-08）や未支給年金（RN-D14-07）とはまったく別の手続きです\nQ.請求期限は？→5年です。期限を過ぎると国庫に帰属し、取り戻せません
RN-D14-28,故人が「契約者」として保険料を払い、被保険者が配偶者や子など別の家族になっている生命保険・医療保険がないか確認する。口座凍結で保険料の引落しが止まると、家族の保険が失効するおそれがある。,故人の死亡保険金の請求（RN-D14-11）とは別に、故人が保険料を払っていた家族の保険が存在する場合があります。口座凍結で引落しが止まり、気づかないうちに保険が失効すると取り返しがつきません。,各保険会社のカスタマーセンター／共済窓口,保険証券、届出人の本人確認書類、死亡確認書類,1. 故人名義の保険証券をすべて確認する\n2. 「契約者＝故人、被保険者＝家族」の保険がないか探す\n3. 該当する保険があれば保険会社に連絡して契約者変更をする\n4. 保険料の支払い方法を変更する,1. 保険証券の「契約者」「被保険者」「受取人」の欄を確認してください。通帳の引落し記録も手がかりになります。\n2. よくあるパターン：夫が契約者で妻が被保険者の医療保険、親が契約者で子が被保険者の学資保険・生命保険です。\n3. 「契約者が亡くなりました。契約者変更の手続きをしたい」と伝えてください。被保険者または保険金受取人が新しい契約者になるのが一般的です。\n4. 口座凍結で引落しが止まっても、多くの保険会社は一定期間（1〜3か月）は失効を猶予します。\nただし猶予期間を過ぎると失効するため、早めの手続きを強くおすすめします。,各社による（多くは平日9:00-17:00）,,,「契約者＝故人、被保険者＝家族」の保険の有無を確認済み。該当する場合は契約者変更・支払い方法変更が完了。,Q.どうやって見つける？→保険証券の「契約者」と「被保険者」が違う人になっている保険を探してください\nQ.失効したらどうなる？→保障がなくなります。復活できる場合もありますが、健康状態の審査が必要になることがあります\nQ.学資保険も対象？→はい。契約者が故人で被保険者がお子さんの学資保険は、契約者変更が必要です。払込免除特約がついている場合もあるので保険会社に確認してください
